Pia,Hernandez,Yes,Norway,"Bergen, Berlin, Bern, Brussels, Edinburgh, Kraków, Munich"
Mindy,Lee,No,Portugal,"Brussels, Florence, Lisbon, Porto, San Marino, Seville, Vienna"
Curtis,Singh,Yes,Belgium,"Brussels, Florence, Moscow, Oia, Paris, Porto, Prague"
Ashley,Miller,No,United Kingdom,"Athens, Dublin, Edinburgh, London, Nice, Seville, Vienna"
Peter,Green,Yes,Greece,"Athens, Bern, Brussels, Florence, Oia, Prague, Siena"
Aiden,Kai,No,Poland,"Amalfi, Athens, Brussels, Kraków, Oia, San Sebastian, Vienna"
Andrew,Magpantay,Yes,Switzerland,"Amsterdam, Budapest, Dublin, Lucerne, Porto, Salzburg, Seville"
